{
  "spec_version": "1.0",
  "id": "browser_forge.order-tools",
  "name": "Order Tools",
  "description": "Sanitized example generated skill.",
  "status": "draft",
  "required_features": [],
  "cli": {
    "entrypoint": "scripts/browser_forge-order-tools",
    "python_requires": ">=3.10",
    "envelope_version": "1.0"
  },
  "auth": {
    "runtime_version": "1.0.0",
    "target_domains": ["api.example.test"],
    "providers": ["browser_cookie"]
  },
  "commands": [
    {
      "id": "doctor",
      "summary": "Checks local prerequisites.",
      "side_effect": false,
      "idempotent": true,
      "inputs": [],
      "outputs": { "schema_ref": "#/$defs/doctor-output" },
      "requires": { "auth": false, "commands": [] },
      "next_actions": [],
      "steps": []
    },
    {
      "id": "auth-status",
      "summary": "Reports redacted authentication status.",
      "side_effect": false,
      "idempotent": true,
      "inputs": [],
      "outputs": { "schema_ref": "#/$defs/auth-status-output" },
      "requires": { "auth": false, "commands": [] },
      "next_actions": [],
      "steps": []
    },
    {
      "id": "describe",
      "summary": "Describes the generated command contract.",
      "side_effect": false,
      "idempotent": true,
      "inputs": [],
      "outputs": { "schema_ref": "#/$defs/describe-output" },
      "requires": { "auth": false, "commands": [] },
      "next_actions": [],
      "steps": []
    }
  ],
  "workflows": [],
  "$defs": {
    "doctor-output": { "type": "object" },
    "auth-status-output": { "type": "object" },
    "describe-output": { "type": "object" }
  }
}
